<?xml version="1.0" encoding="UTF-8"?>
<!DOCTYPE email SYSTEM 'email.dtd'>
<email id="email001">
    <header>
        <from email="john.doe@example.com">John Doe</from>
        <to email="jane.doe@example.com">Jane Doe</to>
        <subject>Meeting Reminder</subject>
        <date>2024/10/17</date>
    </header>
    <body>
        This is a meeting reminder for the scheduled meeting tomorrow at 10 A.M.
    </body>
    <attachment>
        <attachments size="2MB">
            <filename>meeting.agenda.pdf</filename>
            <filetype>application/pdf</filetype>
        </attachments>
    </attachment>
</email>
